"id","user","message","date",
"1608","Administrator","Log File Saved","2013-09-20 17:25:21",
"1609","Administrator","Log File Emptied","2013-09-20 17:25:21",
"1610","marknden@gmail.com","log file saved and sent","2013-09-20 17:25:21",
"1611","Admin01","Invigilator Robert Murphy password update email sent byAdmin01","2013-09-20 17:25:33",
"1612","Admin01","Invigilator Flynn Jones edited byAdmin01","2013-09-20 17:27:14",
"1613","Admin01","Invigilator Flynn Jones password update email sent by Admin01","2013-09-20 17:27:23",
"1614","Admin01","Invigilator Flynn Jones edited byAdmin01","2013-09-20 17:28:33",
"1615","Admin01","Invigilator Flynn Jones password update email sent by Admin01","2013-09-20 17:28:42",
